{
  "path": "examples\\designspace-ufo\\VariationDemo.designspace",
  "formatVersion": "5.2",
  "axes": [
    {
      "tag": "wght",
      "name": "Weight",
      "hidden": false,
      "minimum": 100.0,
      "default": 400.0,
      "maximum": 900.0
    },
    {
      "tag": "wdth",
      "name": "Width",
      "hidden": false,
      "minimum": 75.0,
      "default": 100.0,
      "maximum": 125.0
    }
  ],
  "axisMappings": [
    {
      "inputLocation": {
        "Weight": 700.0,
        "Width": 120.0
      },
      "outputLocation": {
        "Weight": 650.0,
        "Width": 110.0
      },
      "description": "Compress a heavy-wide input toward the center",
      "groupDescription": "Cross-axis mapping example for avar2"
    }
  ],
  "sources": [
    {
      "filename": "masters/VariationDemo-Regular.ufo",
      "name": "regular",
      "location": {
        "Weight": 400.0,
        "Width": 100.0
      },
      "familyName": "Variation Demo",
      "styleName": "Regular"
    },
    {
      "filename": "masters/VariationDemo-Bold.ufo",
      "name": "bold",
      "location": {
        "Weight": 800.0,
        "Width": 100.0
      },
      "familyName": "Variation Demo",
      "styleName": "Bold"
    },
    {
      "filename": "masters/VariationDemo-Condensed.ufo",
      "name": "condensed",
      "location": {
        "Weight": 400.0,
        "Width": 75.0
      },
      "familyName": "Variation Demo",
      "styleName": "Condensed"
    },
    {
      "filename": "masters/VariationDemo-BoldCondensed.ufo",
      "name": "bold-condensed",
      "location": {
        "Weight": 800.0,
        "Width": 75.0
      },
      "familyName": "Variation Demo",
      "styleName": "Bold Condensed"
    }
  ],
  "instances": [
    {
      "name": "Regular",
      "userLocation": {
        "Weight": 400.0,
        "Width": 100.0
      },
      "familyName": "Variation Demo",
      "styleName": "Regular"
    }
  ]
}
